{"assertions":[{"id":"grounded","judgeModel":"example-judge","judgeVersion":"2026-01-15","minScore":85,"rubric":"The summary preserves the supplied facts, distinguishes uncertainty and invents no migration steps.","type":"llmJudge"},{"critical":false,"id":"no-guarantee","type":"notContains","value":"guaranteed"}],"id":"summarize","input":"Summarize the supplied migration notes without inventing facts.","mediaType":"application/vnd.agentsuite.eval.case.v1+json","minPasses":2,"runs":3,"schemaVersion":"1.0.0-draft"}